[
  {
    "carrera": "Administración",
    "facultad": "Facultad de Ciencias Empresariales",
    "Totalmente satisfecho": 152,
    "Muy satisfecho": 106,
    "Satisfecho": 109,
    "Insatisfecho": 5,
    "Totalmente insatisfecho": 1,
    "No utilizo": 0,
    "No conozco": 0,
    "score": 98.39
  },
  {
    "carrera": "Arquitectura",
    "facultad": "Facultad de Arquitectura",
    "Totalmente satisfecho": 142,
    "Muy satisfecho": 110,
    "Satisfecho": 112,
    "Insatisfecho": 5,
    "Totalmente insatisfecho": 1,
    "No utilizo": 0,
    "No conozco": 0,
    "score": 98.38
  },
  {
    "carrera": "Comunicación",
    "facultad": "Facultad de Comunicación",
    "Totalmente satisfecho": 152,
    "Muy satisfecho": 107,
    "Satisfecho": 91,
    "Insatisfecho": 13,
    "Totalmente insatisfecho": 3,
    "No utilizo": 0,
    "No conozco": 0,
    "score": 95.63
  },
  {
    "carrera": "Contabilidad y Finanzas",
    "facultad": "Facultad de Ciencias Empresariales",
    "Totalmente satisfecho": 104,
    "Muy satisfecho": 63,
    "Satisfecho": 50,
    "Insatisfecho": 4,
    "Totalmente insatisfecho": 1,
    "No utilizo": 0,
    "No conozco": 0,
    "score": 97.75
  },
  {
    "carrera": "Derecho",
    "facultad": "Facultad de Derecho",
    "Totalmente satisfecho": 210,
    "Muy satisfecho": 129,
    "Satisfecho": 131,
    "Insatisfecho": 7,
    "Totalmente insatisfecho": 2,
    "No utilizo": 0,
    "No conozco": 0,
    "score": 98.12
  },
  {
    "carrera": "Economía",
    "facultad": "Facultad de Economía",
    "Totalmente satisfecho": 93,
    "Muy satisfecho": 61,
    "Satisfecho": 71,
    "Insatisfecho": 5,
    "Totalmente insatisfecho": 2,
    "No utilizo": 0,
    "No conozco": 0,
    "score": 96.98
  },
  {
    "carrera": "Ingeniería Ambiental",
    "facultad": "Facultad de Ingeniería",
    "Totalmente satisfecho": 9,
    "Muy satisfecho": 6,
    "Satisfecho": 2,
    "Insatisfecho": 0,
    "Totalmente insatisfecho": 0,
    "No utilizo": 0,
    "No conozco": 0,
    "score": 100.0
  },
  {
    "carrera": "Ingeniería Civil",
    "facultad": "Facultad de Ingeniería",
    "Totalmente satisfecho": 133,
    "Muy satisfecho": 103,
    "Satisfecho": 72,
    "Insatisfecho": 4,
    "Totalmente insatisfecho": 0,
    "No utilizo": 0,
    "No conozco": 0,
    "score": 98.72
  },
  {
    "carrera": "Ingeniería Industrial",
    "facultad": "Facultad de Ingeniería",
    "Totalmente satisfecho": 213,
    "Muy satisfecho": 148,
    "Satisfecho": 78,
    "Insatisfecho": 4,
    "Totalmente insatisfecho": 1,
    "No utilizo": 0,
    "No conozco": 0,
    "score": 98.87
  },
  {
    "carrera": "Ingeniería Mecatrónica",
    "facultad": "Facultad de Ingeniería",
    "Totalmente satisfecho": 17,
    "Muy satisfecho": 12,
    "Satisfecho": 12,
    "Insatisfecho": 3,
    "Totalmente insatisfecho": 0,
    "No utilizo": 0,
    "No conozco": 0,
    "score": 93.18
  },
  {
    "carrera": "Ingeniería de Sistemas",
    "facultad": "Facultad de Ingeniería",
    "Totalmente satisfecho": 152,
    "Muy satisfecho": 92,
    "Satisfecho": 89,
    "Insatisfecho": 4,
    "Totalmente insatisfecho": 1,
    "No utilizo": 0,
    "No conozco": 0,
    "score": 98.52
  },
  {
    "carrera": "Marketing",
    "facultad": "Facultad de Ciencias Empresariales",
    "Totalmente satisfecho": 141,
    "Muy satisfecho": 91,
    "Satisfecho": 64,
    "Insatisfecho": 7,
    "Totalmente insatisfecho": 1,
    "No utilizo": 0,
    "No conozco": 0,
    "score": 97.37
  },
  {
    "carrera": "Negocios Internacionales",
    "facultad": "Facultad de Ciencias Empresariales",
    "Totalmente satisfecho": 133,
    "Muy satisfecho": 100,
    "Satisfecho": 69,
    "Insatisfecho": 4,
    "Totalmente insatisfecho": 1,
    "No utilizo": 0,
    "No conozco": 0,
    "score": 98.37
  },
  {
    "carrera": "Psicología",
    "facultad": "Facultad de Psicología",
    "Totalmente satisfecho": 155,
    "Muy satisfecho": 153,
    "Satisfecho": 111,
    "Insatisfecho": 10,
    "Totalmente insatisfecho": 2,
    "No utilizo": 0,
    "No conozco": 0,
    "score": 97.22
  }
]